{
  "$schema": "schema/multisensor.schema.json",
  "uuid": "000051c1-0000-1000-8000-00805f9b34fb",
  "title": "Счетчик капель",
  "advName": "DROPS #",
  "moduleName": "DROPS",
  "sensors": [
    {
      "description": "Устройство подсчета капель на штатив",
      "uuid": "ba57501a-eca0-11ec-8ea0-1337ac062022",
      "sound": {
        "sensorType": 0,
        "soundNumber": 126
      }
    }
  ]
}
